tcpdump: verbose output suppressed, use -v or -vv for full protocol decode
listening on wlan0, link-type EN10MB (Ethernet), capture size 262144 bytes
09:31:56.503141 IP ip-192-168-1-100.us-west-2.compute.internal.52278 > sea30s01-in-f3.1e100.net.https: Flags [S], seq 1326596297, win 65535, options [mss 1460,sackOK,TS val 1061975229 ecr 0,nop,wscale 9], length 0
09:31:56.510660 IP sea30s01-in-f3.1e100.net.https > ip-192-168-1-100.us-west-2.compute.internal.52278: Flags [S.], seq 1789727041, ack 1326596298, win 65535, options [mss 1430,sackOK,TS val 871375683 ecr 1061975229,nop,wscale 8], length 0
09:31:56.521321 IP ip-192-168-1-100.us-west-2.compute.internal.52278 > sea30s01-in-f3.1e100.net.https: Flags [.], ack 1, win 128, options [nop,nop,TS val 1061975245 ecr 871375683], length 0
09:31:56.524662 IP ip-192-168-1-100.us-west-2.compute.internal.52278 > sea30s01-in-f3.1e100.net.https: Flags [P.], seq 1:518, ack 1, win 128, options [nop,nop,TS val 1061975251 ecr 871375683], length 517
09:31:56.532108 IP sea30s01-in-f3.1e100.net.https > ip-192-168-1-100.us-west-2.compute.internal.52278: Flags [.], ack 518, win 261, options [nop,nop,TS val 871375705 ecr 1061975251], length 0
09:31:56.538687 IP sea30s01-in-f3.1e100.net.https > ip-192-168-1-100.us-west-2.compute.internal.52278: Flags [.], seq 1:1419, ack 518, win 261, options [nop,nop,TS val 871375711 ecr 1061975251], length 1418
09:31:56.538786 IP sea30s01-in-f3.1e100.net.https > ip-192-168-1-100.us-west-2.compute.internal.52278: Flags [P.], seq 1419:2837, ack 518, win 261, options [nop,nop,TS val 871375711 ecr 1061975251], length 1418
09:31:56.538824 IP sea30s01-in-f3.1e100.net.https > ip-192-168-1-100.us-west-2.compute.internal.52278: Flags [.], seq 2837:4255, ack 518, win 261, options [nop,nop,TS val 871375711 ecr 1061975251], length 1418
09:31:56.538834 IP sea30s01-in-f3.1e100.net.https > ip-192-168-1-100.us-west-2.compute.internal.52278: Flags [P.], seq 4255:4347, ack 518, win 261, options [nop,nop,TS val 871375711 ecr 1061975251], length 92
09:31:56.541260 IP ip-192-168-1-100.us-west-2.compute.internal.52278 > sea30s01-in-f3.1e100.net.https: Flags [.], ack 1419, win 134, options [nop,nop,TS val 1061975268 ecr 871375711], length 0
09:31:56.541472 IP ip-192-168-1-100.us-west-2.compute.internal.52278 > sea30s01-in-f3.1e100.net.https: Flags [.], ack 2837, win 140, options [nop,nop,TS val 1061975269 ecr 871375711], length 0
09:31:56.541667 IP ip-192-168-1-100.us-west-2.compute.internal.52278 > sea30s01-in-f3.1e100.net.https: Flags [.], ack 4255, win 145, options [nop,nop,TS val 1061975269 ecr 871375711], length 0
09:31:56.541860 IP ip-192-168-1-100.us-west-2.compute.internal.52278 > sea30s01-in-f3.1e100.net.https: Flags [.], ack 4347, win 145, options [nop,nop,TS val 1061975269 ecr 871375711], length 0
09:31:56.706838 IP ip-192-168-1-100.us-west-2.compute.internal.52278 > sea30s01-in-f3.1e100.net.https: Flags [P.], seq 518:582, ack 4347, win 145, options [nop,nop,TS val 1061975434 ecr 871375711], length 64
09:31:56.718958 IP sea30s01-in-f3.1e100.net.https > ip-192-168-1-100.us-west-2.compute.internal.52278: Flags [.], ack 582, win 261, options [nop,nop,TS val 871375892 ecr 1061975434], length 0
09:31:56.721987 IP ip-192-168-1-100.us-west-2.compute.internal.52278 > sea30s01-in-f3.1e100.net.https: Flags [P.], seq 582:836, ack 4347, win 145, options [nop,nop,TS val 1061975449 ecr 871375892], length 254
09:31:56.729476 IP sea30s01-in-f3.1e100.net.https > ip-192-168-1-100.us-west-2.compute.internal.52278: Flags [.], ack 836, win 265, options [nop,nop,TS val 871375902 ecr 1061975449], length 0
09:31:56.729553 IP sea30s01-in-f3.1e100.net.https > ip-192-168-1-100.us-west-2.compute.internal.52278: Flags [P.], seq 4347:5183, ack 836, win 265, options [nop,nop,TS val 871375902 ecr 1061975449], length 836
09:31:56.732002 IP ip-192-168-1-100.us-west-2.compute.internal.52278 > sea30s01-in-f3.1e100.net.https: Flags [.], ack 5183, win 151, options [nop,nop,TS val 1061975459 ecr 871375902], length 0
09:31:57.833882 IP ip-192-168-1-100.us-west-2.compute.internal.59670 > sea09s30-in-f14.1e100.net.https: Flags [S], seq 35752827, win 65535, options [mss 1460,sackOK,TS val 3350374605 ecr 0,nop,wscale 9], length 0
09:31:57.843036 IP sea09s30-in-f14.1e100.net.https > ip-192-168-1-100.us-west-2.compute.internal.59670: Flags [S.], seq 3552505777, ack 35752828, win 65535, options [mss 1430,sackOK,TS val 3655065331 ecr 3350374605,nop,wscale 8], length 0
09:31:57.845048 IP ip-192-168-1-100.us-west-2.compute.internal.59670 > sea09s30-in-f14.1e100.net.https: Flags [.], ack 1, win 128, options [nop,nop,TS val 3350374616 ecr 3655065331], length 0
09:31:57.846738 IP ip-192-168-1-100.us-west-2.compute.internal.59670 > sea09s30-in-f14.1e100.net.https: Flags [P.], seq 1:518, ack 1, win 128, options [nop,nop,TS val 3350374618 ecr 3655065331], length 517
09:31:57.855869 IP sea09s30-in-f14.1e100.net.https > ip-192-168-1-100.us-west-2.compute.internal.59670: Flags [.], ack 518, win 261, options [nop,nop,TS val 3655065344 ecr 3350374618], length 0
09:31:57.863456 IP sea09s30-in-f14.1e100.net.https > ip-192-168-1-100.us-west-2.compute.internal.59670: Flags [.], seq 1:1419, ack 518, win 261, options [nop,nop,TS val 3655065351 ecr 3350374618], length 1418
09:31:57.863614 IP sea09s30-in-f14.1e100.net.https > ip-192-168-1-100.us-west-2.compute.internal.59670: Flags [P.], seq 1419:2837, ack 518, win 261, options [nop,nop,TS val 3655065351 ecr 3350374618], length 1418
09:31:57.863676 IP sea09s30-in-f14.1e100.net.https > ip-192-168-1-100.us-west-2.compute.internal.59670: Flags [.], seq 2837:4255, ack 518, win 261, options [nop,nop,TS val 3655065351 ecr 3350374618], length 1418
09:31:57.863687 IP sea09s30-in-f14.1e100.net.https > ip-192-168-1-100.us-west-2.compute.internal.59670: Flags [P.], seq 4255:4303, ack 518, win 261, options [nop,nop,TS val 3655065351 ecr 3350374618], length 48
09:31:57.866173 IP ip-192-168-1-100.us-west-2.compute.internal.59670 > sea09s30-in-f14.1e100.net.https: Flags [.], ack 1419, win 134, options [nop,nop,TS val 3350374637 ecr 3655065351], length 0
09:31:57.866547 IP ip-192-168-1-100.us-west-2.compute.internal.59670 > sea09s30-in-f14.1e100.net.https: Flags [.], ack 2837, win 140, options [nop,nop,TS val 3350374638 ecr 3655065351], length 0
09:31:57.866744 IP ip-192-168-1-100.us-west-2.compute.internal.59670 > sea09s30-in-f14.1e100.net.https: Flags [.], ack 4303, win 146, options [nop,nop,TS val 3350374638 ecr 3655065351], length 0
09:31:57.939956 IP ip-192-168-1-100.us-west-2.compute.internal.59670 > sea09s30-in-f14.1e100.net.https: Flags [P.], seq 518:582, ack 4303, win 146, options [nop,nop,TS val 3350374711 ecr 3655065351], length 64
09:31:57.954481 IP sea09s30-in-f14.1e100.net.https > ip-192-168-1-100.us-west-2.compute.internal.59670: Flags [.], ack 582, win 261, options [nop,nop,TS val 3655065442 ecr 3350374711], length 0
09:31:57.956762 IP ip-192-168-1-100.us-west-2.compute.internal.59670 > sea09s30-in-f14.1e100.net.https: Flags [P.], seq 582:1405, ack 4303, win 146, options [nop,nop,TS val 3350374728 ecr 3655065442], length 823
09:31:57.966479 IP sea09s30-in-f14.1e100.net.https > ip-192-168-1-100.us-west-2.compute.internal.59670: Flags [.], ack 1405, win 272, options [nop,nop,TS val 3655065454 ecr 3350374728], length 0
09:31:57.984720 IP ip-192-168-1-100.us-west-2.compute.internal.36256 > ec2-34-251-154-25.eu-west-1.compute.amazonaws.com.https: Flags [S], seq 150905876, win 65535, options [mss 1460,sackOK,TS val 4156866174 ecr 0,nop,wscale 9], length 0
09:31:58.006008 IP ip-192-168-1-100.us-west-2.compute.internal.59674 > sea09s30-in-f14.1e100.net.https: Flags [S], seq 582194664, win 65535, options [mss 1460,sackOK,TS val 3350374776 ecr 0,nop,wscale 9], length 0
09:31:58.013221 IP sea09s30-in-f14.1e100.net.https > ip-192-168-1-100.us-west-2.compute.internal.59674: Flags [S.], seq 2586722441, ack 582194665, win 65535, options [mss 1430,sackOK,TS val 2611105640 ecr 3350374776,nop,wscale 8], length 0
09:31:58.015573 IP ip-192-168-1-100.us-west-2.compute.internal.59674 > sea09s30-in-f14.1e100.net.https: Flags [.], ack 1, win 128, options [nop,nop,TS val 3350374787 ecr 2611105640], length 0
09:31:58.036909 IP ip-192-168-1-100.us-west-2.compute.internal.59674 > sea09s30-in-f14.1e100.net.https: Flags [P.], seq 1:518, ack 1, win 128, options [nop,nop,TS val 3350374808 ecr 2611105640], length 517
09:31:58.044138 IP sea09s30-in-f14.1e100.net.https > ip-192-168-1-100.us-west-2.compute.internal.59674: Flags [.], ack 518, win 261, options [nop,nop,TS val 2611105671 ecr 3350374808], length 0
09:31:58.052686 IP sea09s30-in-f14.1e100.net.https > ip-192-168-1-100.us-west-2.compute.internal.59674: Flags [.], seq 1:1419, ack 518, win 261, options [nop,nop,TS val 2611105678 ecr 3350374808], length 1418
09:31:58.052709 IP sea09s30-in-f14.1e100.net.https > ip-192-168-1-100.us-west-2.compute.internal.59674: Flags [P.], seq 1419:2837, ack 518, win 261, options [nop,nop,TS val 2611105678 ecr 3350374808], length 1418
09:31:58.052825 IP sea09s30-in-f14.1e100.net.https > ip-192-168-1-100.us-west-2.compute.internal.59674: Flags [.], seq 2837:4255, ack 518, win 261, options [nop,nop,TS val 2611105678 ecr 3350374808], length 1418
09:31:58.052838 IP sea09s30-in-f14.1e100.net.https > ip-192-168-1-100.us-west-2.compute.internal.59674: Flags [P.], seq 4255:4302, ack 518, win 261, options [nop,nop,TS val 2611105678 ecr 3350374808], length 47
09:31:58.055504 IP ip-192-168-1-100.us-west-2.compute.internal.59674 > sea09s30-in-f14.1e100.net.https: Flags [.], ack 1419, win 134, options [nop,nop,TS val 3350374826 ecr 2611105678], length 0
09:31:58.055858 IP ip-192-168-1-100.us-west-2.compute.internal.59674 > sea09s30-in-f14.1e100.net.https: Flags [.], ack 2837, win 140, options [nop,nop,TS val 3350374827 ecr 2611105678], length 0
09:31:58.056076 IP ip-192-168-1-100.us-west-2.compute.internal.59674 > sea09s30-in-f14.1e100.net.https: Flags [.], ack 4302, win 146, options [nop,nop,TS val 3350374827 ecr 2611105678], length 0
09:31:58.100151 IP ip-192-168-1-100.us-west-2.compute.internal.36260 > ec2-34-251-154-25.eu-west-1.compute.amazonaws.com.https: Flags [S], seq 324189343, win 65535, options [mss 1460,sackOK,TS val 4156866289 ecr 0,nop,wscale 9], length 0
09:31:58.108120 IP ip-192-168-1-100.us-west-2.compute.internal.59674 > sea09s30-in-f14.1e100.net.https: Flags [P.], seq 518:582, ack 4302, win 146, options [nop,nop,TS val 3350374879 ecr 2611105678], length 64
09:31:58.110801 IP ec2-34-251-154-25.eu-west-1.compute.amazonaws.com.https > ip-192-168-1-100.us-west-2.compute.internal.36256: Flags [S.], seq 1380675298, ack 150905877, win 26847, options [mss 1460,sackOK,TS val 3811916165 ecr 4156866174,nop,wscale 8], length 0
09:31:58.114162 IP ip-192-168-1-100.us-west-2.compute.internal.36256 > ec2-34-251-154-25.eu-west-1.compute.amazonaws.com.https: Flags [.], ack 1, win 128, options [nop,nop,TS val 4156866303 ecr 3811916165], length 0
09:31:58.121108 IP sea09s30-in-f14.1e100.net.https > ip-192-168-1-100.us-west-2.compute.internal.59674: Flags [.], ack 582, win 261, options [nop,nop,TS val 2611105747 ecr 3350374879], length 0
09:31:58.122793 IP ip-192-168-1-100.us-west-2.compute.internal.36256 > ec2-34-251-154-25.eu-west-1.compute.amazonaws.com.https: Flags [P.], seq 1:518, ack 1, win 128, options [nop,nop,TS val 4156866312 ecr 3811916165], length 517
09:31:58.123494 IP ip-192-168-1-100.us-west-2.compute.internal.59674 > sea09s30-in-f14.1e100.net.https: Flags [P.], seq 582:1399, ack 4302, win 146, options [nop,nop,TS val 3350374895 ecr 2611105747], length 817
09:31:58.132042 IP sea09s30-in-f14.1e100.net.https > ip-192-168-1-100.us-west-2.compute.internal.59674: Flags [.], ack 1399, win 272, options [nop,nop,TS val 2611105758 ecr 3350374895], length 0
09:31:58.162298 IP sea09s30-in-f14.1e100.net.https > ip-192-168-1-100.us-west-2.compute.internal.59670: Flags [P.], seq 4303:5413, ack 1405, win 272, options [nop,nop,TS val 3655065650 ecr 3350374728], length 1110
09:31:58.162391 IP sea09s30-in-f14.1e100.net.https > ip-192-168-1-100.us-west-2.compute.internal.59670: Flags [P.], seq 5413:5770, ack 1405, win 272, options [nop,nop,TS val 3655065650 ecr 3350374728], length 357
09:31:58.162491 IP sea09s30-in-f14.1e100.net.https > ip-192-168-1-100.us-west-2.compute.internal.59670: Flags [P.], seq 5770:5797, ack 1405, win 272, options [nop,nop,TS val 3655065650 ecr 3350374728], length 27
09:31:58.165226 IP ip-192-168-1-100.us-west-2.compute.internal.59670 > sea09s30-in-f14.1e100.net.https: Flags [.], ack 5413, win 151, options [nop,nop,TS val 3350374936 ecr 3655065650], length 0
09:31:58.165563 IP ip-192-168-1-100.us-west-2.compute.internal.59670 > sea09s30-in-f14.1e100.net.https: Flags [.], ack 5770, win 157, options [nop,nop,TS val 3350374937 ecr 3655065650], length 0
09:31:58.165784 IP ip-192-168-1-100.us-west-2.compute.internal.59670 > sea09s30-in-f14.1e100.net.https: Flags [.], ack 5797, win 157, options [nop,nop,TS val 3350374937 ecr 3655065650], length 0
09:31:58.226269 IP ec2-34-251-154-25.eu-west-1.compute.amazonaws.com.https > ip-192-168-1-100.us-west-2.compute.internal.36260: Flags [S.], seq 3584434531, ack 324189344, win 26847, options [mss 1460,sackOK,TS val 3811916293 ecr 4156866289,nop,wscale 8], length 0
09:31:58.228567 IP ip-192-168-1-100.us-west-2.compute.internal.36260 > ec2-34-251-154-25.eu-west-1.compute.amazonaws.com.https: Flags [.], ack 1, win 128, options [nop,nop,TS val 4156866418 ecr 3811916293], length 0
09:31:58.235866 IP ip-192-168-1-100.us-west-2.compute.internal.36260 > ec2-34-251-154-25.eu-west-1.compute.amazonaws.com.https: Flags [P.], seq 1:518, ack 1, win 128, options [nop,nop,TS val 4156866425 ecr 3811916293], length 517
09:31:58.248837 IP ec2-34-251-154-25.eu-west-1.compute.amazonaws.com.https > ip-192-168-1-100.us-west-2.compute.internal.36256: Flags [.], ack 518, win 119, options [nop,nop,TS val 3811916320 ecr 4156866312], length 0
09:31:58.256240 IP ec2-34-251-154-25.eu-west-1.compute.amazonaws.com.https > ip-192-168-1-100.us-west-2.compute.internal.36256: Flags [.], seq 1:1449, ack 518, win 119, options [nop,nop,TS val 3811916327 ecr 4156866312], length 1448
09:31:58.256329 IP ec2-34-251-154-25.eu-west-1.compute.amazonaws.com.https > ip-192-168-1-100.us-west-2.compute.internal.36256: Flags [.], seq 1449:2897, ack 518, win 119, options [nop,nop,TS val 3811916327 ecr 4156866312], length 1448
09:31:58.256344 IP ec2-34-251-154-25.eu-west-1.compute.amazonaws.com.https > ip-192-168-1-100.us-west-2.compute.internal.36256: Flags [P.], seq 2897:4097, ack 518, win 119, options [nop,nop,TS val 3811916327 ecr 4156866312], length 1200
09:31:58.259274 IP ip-192-168-1-100.us-west-2.compute.internal.36256 > ec2-34-251-154-25.eu-west-1.compute.amazonaws.com.https: Flags [.], ack 4097, win 144, options [nop,nop,TS val 4156866449 ecr 3811916327], length 0
09:31:58.260072 IP ec2-34-251-154-25.eu-west-1.compute.amazonaws.com.https > ip-192-168-1-100.us-west-2.compute.internal.36256: Flags [.], seq 4097:5545, ack 518, win 119, options [nop,nop,TS val 3811916331 ecr 4156866312], length 1448
09:31:58.260180 IP ec2-34-251-154-25.eu-west-1.compute.amazonaws.com.https > ip-192-168-1-100.us-west-2.compute.internal.36256: Flags [P.], seq 5545:6303, ack 518, win 119, options [nop,nop,TS val 3811916331 ecr 4156866312], length 758
09:31:58.262767 IP ip-192-168-1-100.us-west-2.compute.internal.36256 > ec2-34-251-154-25.eu-west-1.compute.amazonaws.com.https: Flags [.], ack 6303, win 153, options [nop,nop,TS val 4156866452 ecr 3811916331], length 0
09:31:58.286469 IP ip-192-168-1-100.us-west-2.compute.internal.36256 > ec2-34-251-154-25.eu-west-1.compute.amazonaws.com.https: Flags [P.], seq 518:644, ack 6303, win 153, options [nop,nop,TS val 4156866472 ecr 3811916331], length 126
09:31:58.361925 IP ec2-34-251-154-25.eu-west-1.compute.amazonaws.com.https > ip-192-168-1-100.us-west-2.compute.internal.36260: Flags [.], ack 518, win 119, options [nop,nop,TS val 3811916433 ecr 4156866425], length 0
09:31:58.365711 IP ec2-34-251-154-25.eu-west-1.compute.amazonaws.com.https > ip-192-168-1-100.us-west-2.compute.internal.36260: Flags [.], seq 1:1449, ack 518, win 119, options [nop,nop,TS val 3811916437 ecr 4156866425], length 1448
09:31:58.365739 IP ec2-34-251-154-25.eu-west-1.compute.amazonaws.com.https > ip-192-168-1-100.us-west-2.compute.internal.36260: Flags [.], seq 1449:2897, ack 518, win 119, options [nop,nop,TS val 3811916437 ecr 4156866425], length 1448
09:31:58.365825 IP ec2-34-251-154-25.eu-west-1.compute.amazonaws.com.https > ip-192-168-1-100.us-west-2.compute.internal.36260: Flags [P.], seq 2897:4097, ack 518, win 119, options [nop,nop,TS val 3811916437 ecr 4156866425], length 1200
09:31:58.368279 IP ec2-34-251-154-25.eu-west-1.compute.amazonaws.com.https > ip-192-168-1-100.us-west-2.compute.internal.36260: Flags [.], seq 4097:5545, ack 518, win 119, options [nop,nop,TS val 3811916439 ecr 4156866425], length 1448
09:31:58.368370 IP ec2-34-251-154-25.eu-west-1.compute.amazonaws.com.https > ip-192-168-1-100.us-west-2.compute.internal.36260: Flags [P.], seq 5545:6303, ack 518, win 119, options [nop,nop,TS val 3811916439 ecr 4156866425], length 758
09:31:58.368987 IP ip-192-168-1-100.us-west-2.compute.internal.36260 > ec2-34-251-154-25.eu-west-1.compute.amazonaws.com.https: Flags [.], ack 4097, win 144, options [nop,nop,TS val 4156866558 ecr 3811916437], length 0
09:31:58.369123 IP sea09s30-in-f14.1e100.net.https > ip-192-168-1-100.us-west-2.compute.internal.59674: Flags [P.], seq 4302:5412, ack 1399, win 272, options [nop,nop,TS val 2611105996 ecr 3350374895], length 1110
09:31:58.369193 IP sea09s30-in-f14.1e100.net.https > ip-192-168-1-100.us-west-2.compute.internal.59674: Flags [P.], seq 5412:5790, ack 1399, win 272, options [nop,nop,TS val 2611105996 ecr 3350374895], length 378
09:31:58.371394 IP ip-192-168-1-100.us-west-2.compute.internal.36260 > ec2-34-251-154-25.eu-west-1.compute.amazonaws.com.https: Flags [.], ack 6303, win 153, options [nop,nop,TS val 4156866560 ecr 3811916439], length 0
09:31:58.372146 IP ip-192-168-1-100.us-west-2.compute.internal.59674 > sea09s30-in-f14.1e100.net.https: Flags [.], ack 5412, win 151, options [nop,nop,TS val 3350375143 ecr 2611105996], length 0
09:31:58.372351 IP ip-192-168-1-100.us-west-2.compute.internal.59674 > sea09s30-in-f14.1e100.net.https: Flags [.], ack 5790, win 157, options [nop,nop,TS val 3350375143 ecr 2611105996], length 0
09:31:58.395871 IP ip-192-168-1-100.us-west-2.compute.internal.36260 > ec2-34-251-154-25.eu-west-1.compute.amazonaws.com.https: Flags [P.], seq 518:644, ack 6303, win 153, options [nop,nop,TS val 4156866585 ecr 3811916439], length 126
09:31:58.413404 IP ec2-34-251-154-25.eu-west-1.compute.amazonaws.com.https > ip-192-168-1-100.us-west-2.compute.internal.36256: Flags [P.], seq 6303:6354, ack 644, win 119, options [nop,nop,TS val 3811916484 ecr 4156866472], length 51
09:31:58.417635 IP ip-192-168-1-100.us-west-2.compute.internal.36256 > ec2-34-251-154-25.eu-west-1.compute.amazonaws.com.https: Flags [P.], seq 644:989, ack 6354, win 153, options [nop,nop,TS val 4156866607 ecr 3811916484], length 345
09:31:58.530091 IP ec2-34-251-154-25.eu-west-1.compute.amazonaws.com.https > ip-192-168-1-100.us-west-2.compute.internal.36260: Flags [P.], seq 6303:6354, ack 644, win 119, options [nop,nop,TS val 3811916601 ecr 4156866585], length 51
09:31:58.540101 IP ip-192-168-1-100.us-west-2.compute.internal.36260 > ec2-34-251-154-25.eu-west-1.compute.amazonaws.com.https: Flags [P.], seq 644:1064, ack 6354, win 153, options [nop,nop,TS val 4156866724 ecr 3811916601], length 420
09:31:58.555374 IP ec2-34-251-154-25.eu-west-1.compute.amazonaws.com.https > ip-192-168-1-100.us-west-2.compute.internal.36256: Flags [P.], seq 6354:7189, ack 989, win 123, options [nop,nop,TS val 3811916626 ecr 4156866607], length 835
09:31:58.594936 IP ip-192-168-1-100.us-west-2.compute.internal.36256 > ec2-34-251-154-25.eu-west-1.compute.amazonaws.com.https: Flags [.], ack 7189, win 159, options [nop,nop,TS val 4156866784 ecr 3811916626], length 0
09:31:58.662420 IP ip-192-168-1-100.us-west-2.compute.internal.45166 > sea09s29-in-f14.1e100.net.https: Flags [P.], seq 1884832456:1884833872, ack 979125418, win 190, options [nop,nop,TS val 1372095400 ecr 1365986503], length 1416
09:31:58.669743 IP sea09s29-in-f14.1e100.net.https > ip-192-168-1-100.us-west-2.compute.internal.45166: Flags [.], ack 1416, win 515, options [nop,nop,TS val 1366127454 ecr 1372095400], length 0
09:31:58.669930 IP ec2-34-251-154-25.eu-west-1.compute.amazonaws.com.https > ip-192-168-1-100.us-west-2.compute.internal.36260: Flags [P.], seq 6354:7165, ack 1064, win 123, options [nop,nop,TS val 3811916741 ecr 4156866724], length 811
09:31:58.710377 IP ip-192-168-1-100.us-west-2.compute.internal.36260 > ec2-34-251-154-25.eu-west-1.compute.amazonaws.com.https: Flags [.], ack 7165, win 159, options [nop,nop,TS val 4156866900 ecr 3811916741], length 0
09:31:58.850175 IP sea09s29-in-f14.1e100.net.https > ip-192-168-1-100.us-west-2.compute.internal.45166: Flags [P.], seq 1:1419, ack 1416, win 515, options [nop,nop,TS val 1366127634 ecr 1372095400], length 1418
09:31:58.850350 IP sea09s29-in-f14.1e100.net.https > ip-192-168-1-100.us-west-2.compute.internal.45166: Flags [.], seq 1419:2837, ack 1416, win 515, options [nop,nop,TS val 1366127635 ecr 1372095400], length 1418
09:31:58.850367 IP sea09s29-in-f14.1e100.net.https > ip-192-168-1-100.us-west-2.compute.internal.45166: Flags [P.], seq 2837:4255, ack 1416, win 515, options [nop,nop,TS val 1366127635 ecr 1372095400], length 1418
09:31:58.850969 IP sea09s29-in-f14.1e100.net.https > ip-192-168-1-100.us-west-2.compute.internal.45166: Flags [.], seq 4255:5673, ack 1416, win 515, options [nop,nop,TS val 1366127635 ecr 1372095400], length 1418
09:31:58.851049 IP sea09s29-in-f14.1e100.net.https > ip-192-168-1-100.us-west-2.compute.internal.45166: Flags [P.], seq 5673:7091, ack 1416, win 515, options [nop,nop,TS val 1366127635 ecr 1372095400], length 1418
09:31:58.851619 IP sea09s29-in-f14.1e100.net.https > ip-192-168-1-100.us-west-2.compute.internal.45166: Flags [P.], seq 7091:8258, ack 1416, win 515, options [nop,nop,TS val 1366127636 ecr 1372095400], length 1167
09:31:58.853746 IP ip-192-168-1-100.us-west-2.compute.internal.45166 > sea09s29-in-f14.1e100.net.https: Flags [.], ack 1419, win 196, options [nop,nop,TS val 1372095590 ecr 1366127634], length 0
09:31:58.853948 IP ip-192-168-1-100.us-west-2.compute.internal.45166 > sea09s29-in-f14.1e100.net.https: Flags [.], ack 2837, win 201, options [nop,nop,TS val 1372095591 ecr 1366127635], length 0
09:31:58.856667 IP ip-192-168-1-100.us-west-2.compute.internal.45166 > sea09s29-in-f14.1e100.net.https: Flags [.], ack 4255, win 207, options [nop,nop,TS val 1372095593 ecr 1366127635], length 0
09:31:58.857004 IP ip-192-168-1-100.us-west-2.compute.internal.45166 > sea09s29-in-f14.1e100.net.https: Flags [.], ack 7091, win 218, options [nop,nop,TS val 1372095594 ecr 1366127635], length 0
09:31:58.857184 IP ip-192-168-1-100.us-west-2.compute.internal.45166 > sea09s29-in-f14.1e100.net.https: Flags [.], ack 8258, win 224, options [nop,nop,TS val 1372095594 ecr 1366127636], length 0
09:31:59.026344 IP ip-192-168-1-100.us-west-2.compute.internal.36256 > ec2-34-251-154-25.eu-west-1.compute.amazonaws.com.https: Flags [F.], seq 989, ack 7189, win 159, options [nop,nop,TS val 4156867215 ecr 3811916626], length 0
09:31:59.152650 IP ec2-34-251-154-25.eu-west-1.compute.amazonaws.com.https > ip-192-168-1-100.us-west-2.compute.internal.36256: Flags [P.], seq 7189:7220, ack 990, win 123, options [nop,nop,TS val 3811917223 ecr 4156867215], length 31
09:31:59.152703 IP ec2-34-251-154-25.eu-west-1.compute.amazonaws.com.https > ip-192-168-1-100.us-west-2.compute.internal.36256: Flags [F.], seq 7220, ack 990, win 123, options [nop,nop,TS val 3811917223 ecr 4156867215], length 0
09:31:59.155999 IP ip-192-168-1-100.us-west-2.compute.internal.36256 > ec2-34-251-154-25.eu-west-1.compute.amazonaws.com.https: Flags [R], seq 150906866, win 0, length 0
09:31:59.156613 IP ip-192-168-1-100.us-west-2.compute.internal.36256 > ec2-34-251-154-25.eu-west-1.compute.amazonaws.com.https: Flags [R], seq 150906866, win 0, length 0
09:31:59.355994 IP ip-192-168-1-100.us-west-2.compute.internal.54692 > ec2-54-171-138-200.eu-west-1.compute.amazonaws.com.https: Flags [S], seq 1652569021, win 65535, options [mss 1460,sackOK,TS val 2242900140 ecr 0,nop,wscale 9], length 0
09:31:59.366741 IP ip-192-168-1-100.us-west-2.compute.internal.59670 > sea09s30-in-f14.1e100.net.https: Flags [P.], seq 1405:2170, ack 5797, win 157, options [nop,nop,TS val 3350376138 ecr 3655065650], length 765
09:31:59.376644 IP sea09s30-in-f14.1e100.net.https > ip-192-168-1-100.us-west-2.compute.internal.59670: Flags [.], ack 2170, win 278, options [nop,nop,TS val 3655066864 ecr 3350376138], length 0
09:31:59.472918 IP ec2-54-171-138-200.eu-west-1.compute.amazonaws.com.https > ip-192-168-1-100.us-west-2.compute.internal.54692: Flags [S.], seq 2568286210, ack 1652569022, win 26847, options [mss 1460,sackOK,TS val 4073032354 ecr 2242900140,nop,wscale 8], length 0
09:31:59.475195 IP ip-192-168-1-100.us-west-2.compute.internal.54692 > ec2-54-171-138-200.eu-west-1.compute.amazonaws.com.https: Flags [.], ack 1, win 128, options [nop,nop,TS val 2242900260 ecr 4073032354], length 0
09:31:59.482400 IP ip-192-168-1-100.us-west-2.compute.internal.54692 > ec2-54-171-138-200.eu-west-1.compute.amazonaws.com.https: Flags [P.], seq 1:518, ack 1, win 128, options [nop,nop,TS val 2242900266 ecr 4073032354], length 517
09:31:59.578453 IP ip-192-168-1-100.us-west-2.compute.internal.52278 > sea30s01-in-f3.1e100.net.https: Flags [P.], seq 836:1090, ack 5183, win 151, options [nop,nop,TS val 1061978305 ecr 871375902], length 254
09:31:59.587371 IP sea30s01-in-f3.1e100.net.https > ip-192-168-1-100.us-west-2.compute.internal.52278: Flags [P.], seq 5183:5461, ack 1090, win 269, options [nop,nop,TS val 871378759 ecr 1061978305], length 278
09:31:59.593144 IP ip-192-168-1-100.us-west-2.compute.internal.52278 > sea30s01-in-f3.1e100.net.https: Flags [.], ack 5461, win 157, options [nop,nop,TS val 1061978320 ecr 871378759], length 0
09:31:59.599248 IP ec2-54-171-138-200.eu-west-1.compute.amazonaws.com.https > ip-192-168-1-100.us-west-2.compute.internal.54692: Flags [.], ack 518, win 110, options [nop,nop,TS val 4073032481 ecr 2242900266], length 0
09:31:59.599449 IP ec2-54-171-138-200.eu-west-1.compute.amazonaws.com.https > ip-192-168-1-100.us-west-2.compute.internal.54692: Flags [.], seq 1:1449, ack 518, win 110, options [nop,nop,TS val 4073032481 ecr 2242900266], length 1448
09:31:59.599469 IP ec2-54-171-138-200.eu-west-1.compute.amazonaws.com.https > ip-192-168-1-100.us-west-2.compute.internal.54692: Flags [.], seq 1449:2897, ack 518, win 110, options [nop,nop,TS val 4073032481 ecr 2242900266], length 1448
09:31:59.599480 IP ec2-54-171-138-200.eu-west-1.compute.amazonaws.com.https > ip-192-168-1-100.us-west-2.compute.internal.54692: Flags [P.], seq 2897:4097, ack 518, win 110, options [nop,nop,TS val 4073032481 ecr 2242900266], length 1200
09:31:59.600932 IP ec2-54-171-138-200.eu-west-1.compute.amazonaws.com.https > ip-192-168-1-100.us-west-2.compute.internal.54692: Flags [.], seq 4097:5545, ack 518, win 110, options [nop,nop,TS val 4073032482 ecr 2242900266], length 1448
09:31:59.600955 IP ec2-54-171-138-200.eu-west-1.compute.amazonaws.com.https > ip-192-168-1-100.us-west-2.compute.internal.54692: Flags [P.], seq 5545:6303, ack 518, win 110, options [nop,nop,TS val 4073032482 ecr 2242900266], length 758
09:31:59.606370 IP ip-192-168-1-100.us-west-2.compute.internal.54692 > ec2-54-171-138-200.eu-west-1.compute.amazonaws.com.https: Flags [.], ack 4097, win 144, options [nop,nop,TS val 2242900391 ecr 4073032481], length 0
09:31:59.606629 IP ip-192-168-1-100.us-west-2.compute.internal.54692 > ec2-54-171-138-200.eu-west-1.compute.amazonaws.com.https: Flags [.], ack 6303, win 153, options [nop,nop,TS val 2242900391 ecr 4073032482], length 0
09:31:59.621034 IP ip-192-168-1-100.us-west-2.compute.internal.54692 > ec2-54-171-138-200.eu-west-1.compute.amazonaws.com.https: Flags [P.], seq 518:644, ack 6303, win 153, options [nop,nop,TS val 2242900405 ecr 4073032482], length 126
09:31:59.738173 IP ec2-54-171-138-200.eu-west-1.compute.amazonaws.com.https > ip-192-168-1-100.us-west-2.compute.internal.54692: Flags [P.], seq 6303:6354, ack 644, win 110, options [nop,nop,TS val 4073032619 ecr 2242900405], length 51
09:31:59.743532 IP ip-192-168-1-100.us-west-2.compute.internal.54692 > ec2-54-171-138-200.eu-west-1.compute.amazonaws.com.https: Flags [P.], seq 644:1463, ack 6354, win 153, options [nop,nop,TS val 2242900527 ecr 4073032619], length 819
09:31:59.847933 IP sea09s30-in-f14.1e100.net.https > ip-192-168-1-100.us-west-2.compute.internal.59670: Flags [P.], seq 5797:6373, ack 2170, win 278, options [nop,nop,TS val 3655067335 ecr 3350376138], length 576
09:31:59.848044 IP sea09s30-in-f14.1e100.net.https > ip-192-168-1-100.us-west-2.compute.internal.59670: Flags [P.], seq 6373:6773, ack 2170, win 278, options [nop,nop,TS val 3655067335 ecr 3350376138], length 400
09:31:59.848064 IP sea09s30-in-f14.1e100.net.https > ip-192-168-1-100.us-west-2.compute.internal.59670: Flags [P.], seq 6773:6800, ack 2170, win 278, options [nop,nop,TS val 3655067335 ecr 3350376138], length 27
09:31:59.850385 IP ip-192-168-1-100.us-west-2.compute.internal.59670 > sea09s30-in-f14.1e100.net.https: Flags [.], ack 6373, win 162, options [nop,nop,TS val 3350376622 ecr 3655067335], length 0
09:31:59.850559 IP ip-192-168-1-100.us-west-2.compute.internal.59670 > sea09s30-in-f14.1e100.net.https: Flags [.], ack 6773, win 168, options [nop,nop,TS val 3350376622 ecr 3655067335], length 0
09:31:59.850685 IP ip-192-168-1-100.us-west-2.compute.internal.59670 > sea09s30-in-f14.1e100.net.https: Flags [.], ack 6800, win 168, options [nop,nop,TS val 3350376623 ecr 3655067335], length 0
09:31:59.904068 IP ec2-54-171-138-200.eu-west-1.compute.amazonaws.com.https > ip-192-168-1-100.us-west-2.compute.internal.54692: Flags [.], ack 1463, win 116, options [nop,nop,TS val 4073032785 ecr 2242900527], length 0
09:31:59.908197 IP ec2-54-171-138-200.eu-west-1.compute.amazonaws.com.https > ip-192-168-1-100.us-west-2.compute.internal.54692: Flags [P.], seq 6354:6920, ack 1463, win 116, options [nop,nop,TS val 4073032789 ecr 2242900527], length 566
09:31:59.908244 IP ec2-54-171-138-200.eu-west-1.compute.amazonaws.com.https > ip-192-168-1-100.us-west-2.compute.internal.54692: Flags [P.], seq 6920:7482, ack 1463, win 116, options [nop,nop,TS val 4073032790 ecr 2242900527], length 562
09:31:59.914404 IP ip-192-168-1-100.us-west-2.compute.internal.54692 > ec2-54-171-138-200.eu-west-1.compute.amazonaws.com.https: Flags [.], ack 7482, win 164, options [nop,nop,TS val 2242900699 ecr 4073032789], length 0
09:32:00.994191 IP ip-192-168-1-100.us-west-2.compute.internal.41860 > sea09s29-in-f10.1e100.net.https: Flags [P.], seq 2147696263:2147696708, ack 2380095065, win 152, options [nop,nop,TS val 3752479778 ecr 1156056425], length 445
09:32:01.001834 IP sea09s29-in-f10.1e100.net.https > ip-192-168-1-100.us-west-2.compute.internal.41860: Flags [.], ack 445, win 265, options [nop,nop,TS val 1156130716 ecr 3752479778], length 0
09:32:01.015992 IP sea09s29-in-f10.1e100.net.https > ip-192-168-1-100.us-west-2.compute.internal.41860: Flags [P.], seq 1:258, ack 445, win 265, options [nop,nop,TS val 1156130730 ecr 3752479778], length 257
09:32:01.016168 IP sea09s29-in-f10.1e100.net.https > ip-192-168-1-100.us-west-2.compute.internal.41860: Flags [P.], seq 258:305, ack 445, win 265, options [nop,nop,TS val 1156130730 ecr 3752479778], length 47
09:32:01.016190 IP sea09s29-in-f10.1e100.net.https > ip-192-168-1-100.us-west-2.compute.internal.41860: Flags [P.], seq 305:401, ack 445, win 265, options [nop,nop,TS val 1156130730 ecr 3752479778], length 96
09:32:01.020951 IP ip-192-168-1-100.us-west-2.compute.internal.41860 > sea09s29-in-f10.1e100.net.https: Flags [.], ack 401, win 158, options [nop,nop,TS val 3752479811 ecr 1156130730], length 0
09:32:01.022182 IP ip-192-168-1-100.us-west-2.compute.internal.41860 > sea09s29-in-f10.1e100.net.https: Flags [P.], seq 445:491, ack 401, win 158, options [nop,nop,TS val 3752479813 ecr 1156130730], length 46
09:32:01.034325 IP sea09s29-in-f10.1e100.net.https > ip-192-168-1-100.us-west-2.compute.internal.41860: Flags [.], ack 491, win 265, options [nop,nop,TS val 1156130749 ecr 3752479813], length 0
09:32:01.082044 IP ip-192-168-1-100.us-west-2.compute.internal.45166 > sea09s29-in-f14.1e100.net.https: Flags [P.], seq 1416:2494, ack 8258, win 224, options [nop,nop,TS val 1372097818 ecr 1366127636], length 1078
09:32:01.089821 IP sea09s29-in-f14.1e100.net.https > ip-192-168-1-100.us-west-2.compute.internal.45166: Flags [.], ack 2494, win 527, options [nop,nop,TS val 1366129874 ecr 1372097818], length 0
09:32:01.211563 IP sea09s29-in-f14.1e100.net.https > ip-192-168-1-100.us-west-2.compute.internal.45166: Flags [P.], seq 8258:9676, ack 2494, win 527, options [nop,nop,TS val 1366129994 ecr 1372097818], length 1418
09:32:01.211729 IP sea09s29-in-f14.1e100.net.https > ip-192-168-1-100.us-west-2.compute.internal.45166: Flags [P.], seq 9676:9813, ack 2494, win 527, options [nop,nop,TS val 1366129995 ecr 1372097818], length 137
09:32:01.214065 IP ip-192-168-1-100.us-west-2.compute.internal.45166 > sea09s29-in-f14.1e100.net.https: Flags [.], ack 9676, win 229, options [nop,nop,TS val 1372097951 ecr 1366129994], length 0
09:32:01.214290 IP ip-192-168-1-100.us-west-2.compute.internal.45166 > sea09s29-in-f14.1e100.net.https: Flags [.], ack 9813, win 235, options [nop,nop,TS val 1372097952 ecr 1366129995], length 0
09:32:01.560131 IP ip-192-168-1-100.us-west-2.compute.internal.45166 > sea09s29-in-f14.1e100.net.https: Flags [.], seq 2494:3912, ack 9813, win 235, options [nop,nop,TS val 1372098287 ecr 1366129995], length 1418
09:32:01.560420 IP ip-192-168-1-100.us-west-2.compute.internal.45166 > sea09s29-in-f14.1e100.net.https: Flags [P.], seq 3912:4013, ack 9813, win 235, options [nop,nop,TS val 1372098287 ecr 1366129995], length 101
09:32:01.569363 IP sea09s29-in-f14.1e100.net.https > ip-192-168-1-100.us-west-2.compute.internal.45166: Flags [.], ack 3912, win 538, options [nop,nop,TS val 1366130352 ecr 1372098287], length 0
09:32:01.569548 IP sea09s29-in-f14.1e100.net.https > ip-192-168-1-100.us-west-2.compute.internal.45166: Flags [.], ack 4013, win 538, options [nop,nop,TS val 1366130352 ecr 1372098287], length 0
09:32:01.735427 IP sea09s29-in-f14.1e100.net.https > ip-192-168-1-100.us-west-2.compute.internal.45166: Flags [P.], seq 9813:11231, ack 4013, win 538, options [nop,nop,TS val 1366130520 ecr 1372098287], length 1418
09:32:01.735558 IP sea09s29-in-f14.1e100.net.https > ip-192-168-1-100.us-west-2.compute.internal.45166: Flags [.], seq 11231:12649, ack 4013, win 538, options [nop,nop,TS val 1366130520 ecr 1372098287], length 1418
09:32:01.735573 IP sea09s29-in-f14.1e100.net.https > ip-192-168-1-100.us-west-2.compute.internal.45166: Flags [P.], seq 12649:14067, ack 4013, win 538, options [nop,nop,TS val 1366130520 ecr 1372098287], length 1418
09:32:01.736216 IP sea09s29-in-f14.1e100.net.https > ip-192-168-1-100.us-west-2.compute.internal.45166: Flags [P.], seq 14067:15173, ack 4013, win 538, options [nop,nop,TS val 1366130521 ecr 1372098287], length 1106
09:32:01.736467 IP sea09s29-in-f14.1e100.net.https > ip-192-168-1-100.us-west-2.compute.internal.45166: Flags [P.], seq 15173:15207, ack 4013, win 538, options [nop,nop,TS val 1366130521 ecr 1372098287], length 34
09:32:01.738240 IP ip-192-168-1-100.us-west-2.compute.internal.45166 > sea09s29-in-f14.1e100.net.https: Flags [.], ack 11231, win 240, options [nop,nop,TS val 1372098475 ecr 1366130520], length 0
09:32:01.738412 IP ip-192-168-1-100.us-west-2.compute.internal.45166 > sea09s29-in-f14.1e100.net.https: Flags [.], ack 12649, win 246, options [nop,nop,TS val 1372098476 ecr 1366130520], length 0
09:32:01.739236 IP ip-192-168-1-100.us-west-2.compute.internal.45166 > sea09s29-in-f14.1e100.net.https: Flags [.], ack 14067, win 252, options [nop,nop,TS val 1372098477 ecr 1366130520], length 0
09:32:01.739407 IP ip-192-168-1-100.us-west-2.compute.internal.45166 > sea09s29-in-f14.1e100.net.https: Flags [.], ack 15173, win 257, options [nop,nop,TS val 1372098477 ecr 1366130521], length 0
09:32:01.739535 IP ip-192-168-1-100.us-west-2.compute.internal.45166 > sea09s29-in-f14.1e100.net.https: Flags [.], ack 15207, win 257, options [nop,nop,TS val 1372098477 ecr 1366130521], length 0
09:32:02.527531 IP ip-192-168-1-100.us-west-2.compute.internal.40738 > sea30s08-in-f10.1e100.net.https: Flags [S], seq 3185456171, win 65535, options [mss 1460,sackOK,TS val 4227293775 ecr 0,nop,wscale 9], length 0
09:32:02.534102 IP sea30s08-in-f10.1e100.net.https > ip-192-168-1-100.us-west-2.compute.internal.40738: Flags [S.], seq 2832382877, ack 3185456172, win 65535, options [mss 1430,sackOK,TS val 546377075 ecr 4227293775,nop,wscale 8], length 0
09:32:02.536546 IP ip-192-168-1-100.us-west-2.compute.internal.40738 > sea30s08-in-f10.1e100.net.https: Flags [.], ack 1, win 128, options [nop,nop,TS val 4227293790 ecr 546377075], length 0
09:32:02.542337 IP ip-192-168-1-100.us-west-2.compute.internal.40738 > sea30s08-in-f10.1e100.net.https: Flags [P.], seq 1:188, ack 1, win 128, options [nop,nop,TS val 4227293795 ecr 546377075], length 187
09:32:02.548776 IP sea30s08-in-f10.1e100.net.https > ip-192-168-1-100.us-west-2.compute.internal.40738: Flags [.], ack 188, win 261, options [nop,nop,TS val 546377089 ecr 4227293795], length 0
09:32:02.556144 IP sea30s08-in-f10.1e100.net.https > ip-192-168-1-100.us-west-2.compute.internal.40738: Flags [.], seq 1:1419, ack 188, win 261, options [nop,nop,TS val 546377095 ecr 4227293795], length 1418
09:32:02.556374 IP sea30s08-in-f10.1e100.net.https > ip-192-168-1-100.us-west-2.compute.internal.40738: Flags [.], seq 1419:2837, ack 188, win 261, options [nop,nop,TS val 546377095 ecr 4227293795], length 1418
09:32:02.556390 IP sea30s08-in-f10.1e100.net.https > ip-192-168-1-100.us-west-2.compute.internal.40738: Flags [P.], seq 2837:4255, ack 188, win 261, options [nop,nop,TS val 546377095 ecr 4227293795], length 1418
09:32:02.556567 IP sea30s08-in-f10.1e100.net.https > ip-192-168-1-100.us-west-2.compute.internal.40738: Flags [P.], seq 4255:4602, ack 188, win 261, options [nop,nop,TS val 546377095 ecr 4227293795], length 347
09:32:02.560481 IP ip-192-168-1-100.us-west-2.compute.internal.40738 > sea30s08-in-f10.1e100.net.https: Flags [.], ack 1419, win 134, options [nop,nop,TS val 4227293813 ecr 546377095], length 0
09:32:02.563223 IP ip-192-168-1-100.us-west-2.compute.internal.40738 > sea30s08-in-f10.1e100.net.https: Flags [.], ack 4255, win 145, options [nop,nop,TS val 4227293816 ecr 546377095], length 0
09:32:02.563413 IP ip-192-168-1-100.us-west-2.compute.internal.40738 > sea30s08-in-f10.1e100.net.https: Flags [.], ack 4602, win 151, options [nop,nop,TS val 4227293816 ecr 546377095], length 0
09:32:02.590502 IP ip-192-168-1-100.us-west-2.compute.internal.40738 > sea30s08-in-f10.1e100.net.https: Flags [P.], seq 188:281, ack 4602, win 151, options [nop,nop,TS val 4227293844 ecr 546377095], length 93
09:32:02.598143 IP sea30s08-in-f10.1e100.net.https > ip-192-168-1-100.us-west-2.compute.internal.40738: Flags [P.], seq 4602:4894, ack 281, win 261, options [nop,nop,TS val 546377138 ecr 4227293844], length 292
09:32:02.598224 IP sea30s08-in-f10.1e100.net.https > ip-192-168-1-100.us-west-2.compute.internal.40738: Flags [P.], seq 4894:4963, ack 281, win 261, options [nop,nop,TS val 546377138 ecr 4227293844], length 69
09:32:02.600406 IP ip-192-168-1-100.us-west-2.compute.internal.40738 > sea30s08-in-f10.1e100.net.https: Flags [P.], seq 281:1190, ack 4894, win 156, options [nop,nop,TS val 4227293854 ecr 546377138], length 909
